{"projection_version":"1.0.0","skill_ref":{"name":"a11y","version":"2.4.0"},"generated_at":"2026-07-17T02:46:48.379544+00:00","source_event_watermark":8,"counts":{"succeeded":1,"failed":0,"compensated":0,"recovery_failed":0,"awaiting_approval":0,"hitl_required":0,"reconciliation_required":0,"recovery_pending":0,"denied":0,"cancelled":0},"sample_size":1,"success_rate":1.0,"confidence":1.0,"known_failure_patterns":[],"element_refs":["a_001"],"provenance":[{"kind":"runtime_event_ledger","ref":"append-only SQLite ledger#events=8","version":"4.0.0"}],"run_ref":{"run_id":"ae7aa59b-17a6-47a2-b171-55775829fb2f","status":"succeeded"},"event_count":8,"last_event_type":"run_succeeded","governance_ref":{"policy":"governance.current_revision.approved","canonical_skill_id":"claude__skill__a_y","governance_skill_id":"0e5332ff-84fd-4a04-b6d0-301e712d653e","revision_id":"387a3178-4baf-474c-a959-b1962fe663ab","revision_number":1,"artifact_digest":"sha256:d8e537bb02621ca0f5a03c93e6c17e96c711695356fb84d603017613c634e335","approved_by":"rehearsal-reviewer","approved_at":"2026-07-17T02:46:47.944110"}}
